{
  "schemaVersion": 1,
  "id": "kr-passport",
  "name": "대한민국 여권",
  "audience": "adult",
  "photoMm": [35, 45],
  "headMm": { "min": 32, "max": 36, "target": 34 },
  "topMarginMm": 4.5,
  "background": { "kind": "white", "minLuma": 215, "maxStd": 18 },
  "expression": { "mouthOpen": false, "smile": false, "eyesOpen": true },
  "checks": {
    "faceCount": true,
    "headLength": true,
    "resolution": true,
    "sharpness": true,
    "tilt": true,
    "expression": true,
    "background": true,
    "shadow": true,
    "manual": ["crownLine", "glasses", "lenses", "takenWithin6Months"]
  },
  "digital": {
    "px": [413, 531],
    "wRange": [395, 431],
    "hRange": [507, 550],
    "format": "jpeg",
    "maxKB": 500,
    "dpi": 300
  },
  "print": { "sheetIn": [6, 4], "sheetPx": [1800, 1200], "cols": 4, "rows": 2, "cutLines": true },
  "notes": {
    "ko": "발급 신청일 기준 6개월 이내 촬영, 무표정, 입 다물기, 컬러렌즈·색안경 금지"
  },
  "source": "https://www.passport.go.kr/home/kor/contents.do?menuPos=32",
  "sourceDigital": "https://www.passport.go.kr/home/kor/contents.do?menuPos=12",
  "checkedAt": "2026-10-26"
}
