{
  "schemaVersion": 1,
  "id": "kr-suneung",
  "name": "수능 응시원서",
  "audience": "adult",
  "photoMm": [35, 45],
  "headMm": { "min": 32, "max": 36, "target": 34 },
  "topMarginMm": 4.5,
  "background": { "kind": "white", "minLuma": 215, "maxStd": 25 },
  "expression": { "mouthOpen": false, "smile": false, "eyesOpen": true },
  "checks": {
    "faceCount": true,
    "headLength": true,
    "resolution": true,
    "sharpness": true,
    "tilt": true,
    "expression": true,
    "background": true,
    "shadow": true,
    "manual": ["crownLine", "glasses", "takenWithin6Months"]
  },
  "digital": {
    "px": [413, 531],
    "wRange": [395, 431],
    "hRange": [507, 550],
    "format": "jpeg",
    "maxKB": 500,
    "dpi": 300
  },
  "print": { "sheetIn": [6, 4], "sheetPx": [1800, 1200], "cols": 4, "rows": 2, "cutLines": true },
  "allowedFixes": { "rotate": { "maxDeg": 6 } },
  "notes": {
    "ko": "원서접수일 기준 6개월 이내 촬영한 천연색 상반신 정면 여권용 규격(머리 길이 3.2~3.6cm). 머리카락·안경테로 눈을 가리거나 모자를 쓰면 안 되고, 배경은 균일한 흰색에 테두리가 없어야 함. 온라인 사전입력은 JPG 500KB 이하·413×531px 권장(395~431×507~550px만 업로드), 현장 접수는 인화한 사진 2매"
  },
  "source": "https://www.goe.go.kr/resource/goe/na/bbs_2675/2026/07/4a580487-f61a-43df-8675-ab378e391777.pdf",
  "checkedAt": "2026-10-27"
}
